text,label
- punch the lil hoe out .,0
Niggas ank real when that shit really count...🤧,7
Ok let me ask straight people this question and hopefully this'll say why they don't need a pride: did you ever angst about your sexuality and feel like you had to confirm it to a loved one and fear what they would say or question whether or not you were truly straight?,7
"@CNN @ChrisCuomo The most important role a political leader must exemplify is how nobody should spend their time analyzing race by what a person looks like or where they came from. I have noticed many in politics using RACE as a means to win votes, past and present political candidates.",7
"@user @Twitter @user You reported a page trying to help victims of rape, torture, love jihad syndicate? What a treacherous human being",7
United Nations is like a dead horse. It is blind over Non-muslims Terrorism on Muslims. #TerroristIndia #TerroristIsrael. #FreeIOJ_K_and_Ladakh #FreePalestine. #ShameOnUNO.,7
@user Mmmmm I'll fuck that mouth till you cry then I'm tease that pussy of yours with my 9 inch dick before I eat it,7
@user @user @user @user How about take your trophies and choke on em Soy Fag,2
Our immigration plan ensures that we finally advance a new vision of immigration that fully reflects our country's values and empowers every individual to contribute to the shared greatness of our country. Read it here: {URL} {URL},7
"@user @user @chennaipolice_ Pls refer to page 3 times of India. Since they have applied for US green card, they have mentioned as US woman.",7
"Cis people, when I talk about ""cis privilege,"" I'm not saying you're evil, or trying to tear you down. I envy you. I'd say imagine being born into an identity you're comfortable with, but you don't have to, you live it. And thank heck you'll never have to go through what I did.",7
@user @user @ZaidZamanHamid Cheergurl of pedophile prophet and Zaid Hamid preaching others 😂 ask any Islamic scholar how often evil prophet got drunk on camel piss. That link itself is of gulf hihi,3
"Bitch and Stupid , a lethal combination!",0
"@user The ""Asylum"" part that keeps asylum seekers in Mexico is illegal. It's already been litigated.",7
@user @user the action of a woman does not mean that you all can continue to treat all women as sexual objects,7
The #POHA launch conference starts tomorrow and the #oral_History #archive of #nakba and early days of Palestinian exodus will now enter the public domain.. check @user whole thread {URL},7
"As Black Men, we must not only understand but hold ourselves accountable for the part we contribute to the disrespect & pain Black Women go through. Most of it isn't our own fault. But whether it's generational programming or not, we do have a hand in it. That pain runs deeper.",7
Believe what he's saying . Muslims are out to destroy America in the name of their god . Clean up our Government before it's too late {URL},3
"@user @user So the Pedophilia Temple burned down? That is a coincidence, isn't it, and very convenient for all these perverts.",2
"friendly reminder that peter parker is trans and we support him no matter what! happy pride, spider-man! 🌈 {URL}",7
"In 2018, women only comprised 20% of all directors, writers, producers, executive producers, editors, & cinematographers working on the top 250 domestic grossing films. @KimRaver tells @Alyssa_Milano why she made sure to advocate for other women. Listen {URL} {URL}",7
She is a cunt,0
"""The number was cited by white nationalist Faith Goldy, former editor-in-chief of The Walrus magazine Jonathan Kay..."" Of course. Share widely. Burn that shit down. {URL}",7
"Gotta stop gassing these girls up, they ain't deserve it",7
PM Imran invites Pakistani community to take benefit of investment opportunities in Pakistan {URL} #PMIKInUSA,7
Females need to be consistent too.,7
I can't stand a weak ass bitch ! Ugh y'all disgust me. Boss up lil whore,0
"Just've done binge-ing Queer Eye season 4. It was better than the last season, many teary moments, but still... I kinda missing the part that shows Queer vs Heteronormative society, which I think still exist untill now, or is it really that ""okay"" to be gay in US now?",7
"{URL} Please Stroke Your Cock To Me Ass Daddy, I Need It Bad... From My Latest Video ""Fucked By A Stranger In Public"" Available Now. Remember To Share My Posts My Loves. Thank You :-) #msnovember #sheisnovember #ebonyass #blackass {URL}",7
Someone come fuck her brains out and give her what she really needs! Another cock in her {URL},0
"Interracial and Intertribe Couples married or not, Post your pics under the tag I want to celebrate you, you guys bring nations, cultures and tribes together, your union is the glue that's needed for Nations and tribes to unite together as one ❤❤🙌 #GettingRealWithEmily {URL}",7
🗣Bitch I'm Hood . . Really Really Hood I Be Posted Up Like I Wish A Nigga Would ‼️,7
I hope that nigga that hit my car dies,1
Ugly ass chinese chink ass fuck ward,1
"@user Wait until she finds out women aren't funny, yikes!",7
"@user @user @user @user @AndrewYang Latino isn't a race, {URL} say nothing about many Blacks supporting Kamala.",7
"HAPPY PRIDE MONTH! cyrus goodman is disney channel's first openly gay character ever. since we were introduced to tj kippen, the possibility that we could be getting an lgbt couple on a program pointed towards younger people has become much more probable. {URL}",7
"@user Disgusting language, baloney. Your lies about the four women were far more disgusting.",7
@user pakis pretending they r kashmiris 😂,7
This bitch should be hit with a bat {URL},0
It makes my stomach hurt that all these bitches are hoes and really torment me,0
You don't have to be biracial to be mixed :) {URL},7
south african women are gorgeous okay.,7
"Start shooting these niggas. Try pushing somebody else in the pool when you're dead, bitch. {URL}",1
"@IlhanMN You shoot America and America's president with your words everyday You cut Americans especially white Christians, with your eyes You kill American hearts who took you in to keep you safe with your hateful mentality towards us So we will rise and vote you out",7
"happy pride month!! 🌈 to my lgbtq+ followers: u are valid. u are seen. u are heard. and u are so, so loved.",7
@user Shut the fuck up faggot,2
when someone asks what's for dinner tonight: #nsfw #trap #femboy #gay {URL},7
gay dudes complimenting u are way more sincere n feel nicer than when girls compliment u {URL},7
@user We Pakistani are Turkish and Our Turkish are Pakistani. We are One and United. Thank you ofr supporting Pakistan,7
@user Girls AINT shit,0
when colonizers get mad cause we call them colonizers 😭,7
@RT_com there is no question about one thing .. they imported tens of thousands of uncivilized savages into their countries who hate european ppl and culture ..,4
This is an excellent opportunity for women working in regional media. Applications now open for the @Caroline_J Women in Media Young Journalist's Award. {URL} #wimqld #wimqldatwork,7
"I'm definitely NOT saying ""send her back"", but I AM saying that if #IlhanOmar expects people to treat her immigrant group with compassion and respect, why can't we expect and demand that she do the same for other minority groups? #IStandWithPresTrump {URL}",4
@user @user Dog y'all are the Africans that sold us into slavery then decided to flee Africa cus y'all pussy. You worse off then us😂,1
"The ""Simp"" Niggas These Niggas Always Thinkibg about Pussy and Would Lose Their Mind If Porn Was Extinct In Any Fasion. {URL}",1
Please retweet these little racist Bakersfield fucks :) {URL},1
If you cheat on your girl because she doesn't want sex every time YOU want it. You're trash. How tf you love somebody but not respect their feelings. She's your partner not your property.,7
"@user touch my cock and balls and you'll get a forced lobotomy, dumb cunt",0
"Molly is thinking ""nigger"" in her head.",1
Tribute to Kadambini Ganguly on her birth anniversary. She was one of the first female graduates in India and also one of the first women in India to be trained in western medicine,7
"Israeli police investigating a 3-year-old Palestinian child! Israeli authorities, 'throwing stones to the Israelis' claim! leave a comment .. {URL}",7
@RashidaTlaib @FBI What about the violence of Palestinians using their kids as grenades {URL},7
"@user @user I don't think she's saying ban all marriages. Rather, that a woman's value and worth does not come from what she can do for her husband. Marriage might not be right for everyone and that's fine. A woman still has so much to contribute to society.",7
"@user @user @user That and how religion is always top priority than individual identity. So even if you give all the scientific evidence and statistics, scripture from 1400 years ago will always win.",7
"White supremacists congregate don't they? Why are all these shooters loners? Because they're not white supremacists. Instead they're deranged fodder for a political party overtaken by radical Leftists, grasping at any perch as they slide further down the precipice of 2020. {URL}",7
gays are really something else...,7
@user Hey come join our lgbtq 🏳️‍🌈 safe space an make the path to affiliate easier {URL},7
Pic 1) Balochistan People Want Freedom From Pakistan. Pic 2) Indian We Always With You. #GlobalTerroristPakistan {URL},7
"Congratulations INDIA, congrats @user And well played @user You guys were phenomenal. #WorldCup2019 #INDvSA",7
"@BDUTT You have lost relevance. Out of curiosity, why are you so in love with Pakistan?",7
I remember when @user said it's certain black women you can tell learned everything they know about pro-blackness from cishet black men because their politics are infested with misogyny and self loathing,7
"To the LGBTQIA and nonconforming community... Your @user are always here to support you, raise you up to new heights, friends you can always count on... In the streets fighting for liberty, justice, and equality for ALL! #PrideParade #MKEDems #WisDems #Democrats #Pride {URL}",7
"""As Christians, we eagerly say we want to be like Christ... But many of us are really only asking for the good stuff"" (And the good stuff just for us) #shereadstruthBible #devotional",7
Retweet if you daddies would shove your huge cocks down my throat then dump your load all over my pretty slut face #horny #boobs #tits #pussy #porn #amateurporn #nsfw #cumslut #blowjob #sex #slut #ass #dick #cock #jailbait #bbc #gangbang #cuckold #fuck #fuckme #whore #cumtribute {URL},7
"The El Paso shooter explicitly said he was murdering Mexicans as part of a cause to fight a migrant ""invasion,"" parroting language Tucker uses all the time No self-reflection from Tucker",7
a nigga that don't eat no fat ma can't get no pussy from me... not sorry😭😭 {URL},7
"May Allah Swt bring you joy, happiness, peace and prosperity on this blessed occasion. Wishing you and your family Happy Eid! {URL}",7
same god that turn water to wine gonna turn ur bitch to mine 😇,7
"here me out,,, what if harry bingham was bi.",7
Weak ass demon hoe. Dick sucking slut muffin.,0
"The Arab world is going to regret not speaking up against the crimes & injustice happening in Sudan. At this rate, it is inevitable. #IAmTheSudanRevolution",7
"The White Racist Lying piece of Shit Donald Jackass Trump keep on destroying our country with his RACIST remarks and making easy for all the Bigots to show their Hate. We must VOTE nun White and get the wannabe ""Hitler"" out office.",1
"....done a great job of reducing crime in the African American Community because more African Americans are at work today. Trump is not a Racist, he's a Businessman. Because he's a great businessman, he's pushing for lives to be better."" Michael Brown, CEO, Hydromatic Tech",7
"""I'm able to build relationships with them and their parents because our stories are the same."" As a Black teacher, @user Michael Gilchrist knows what it means for students to see someone who looks like them at the front of the classroom. #Voices4Ed {URL}",7
Fuck the normal fags.,2
@user @BaxtiyarGoran Go fuck yourself if you muslim you hypocrite. Bye,3
the second i figure out exactly what's wrong with me....it's over for you hoes,0
"""I am not African because I was born in #Africa but because Africa was born in me""- Kwame Nkrumah Good morning Africa! #Agenda2063 {URL}",7
🎀 Take the pink pill 🎀 Become a bimbo slut for My amusement. {URL},0
"@user @user Women I would say, my mom and sisters are Superwoman❤",7
"We all know what should happen to this monstrous bunch of lunatics. They are simply vile! ""I support Islam""?? What?? Nutcases. They support beheadings, torture and rape, and as such should be treated accordingly. {URL}",3
#sissy sluts should be locked in #chastity,0
"Honestly so many parts of Arizona fuck with me, but when you consider the mass genocide of Native Americans, it makes sense.",7
"Authoritarian demagogue, undermining democracy and promoting mob rule; Enemy of the Kurdish people, ethnically cleansing villages in Syria #Afrin; Anti-Semite, dedicated to weakening or destroying Israel; Turkey has become a Trojan Horse for Moscow inside NATO",7
"Good morning World, In South Africa, the month of August is dedicated to celebrating Women, for their historic role in liberating South Africa from Apartheid and their continued struggle against systematic discrimination. At BDS SA we celebrate Palestinian Women as well. {URL}",7
@user @Ram_Guha Today is the day when islamoleftists and their support for jihad factory was stopped.. one decision by shah and all the closest separatists have started tumbling out,7
@user @user That nigga back built like the Berlin Wall,7
"@user @user @JordanChariton @IlhanMN Matthew, did Hitler and his fascism simply appear like magic one day, like something in a Harry Potter movie? How many people have to sicken and die at border patrol's hands? Six kids not enough? How about 50? A few thousand have been sexually assaulted. Still not enough? smdh",7
Her: I'm ugly Him: All of Allahs creations are beautiful Her: So that means other girls are beautiful too?,7
Eid Mubakar to all our brothers and sisters. May we have peace and understanding #EidMubarak,7
Some ideas to do about illegals flooding borders. RT until Pres HEARS them loudly!!!,7
#Nigeria: Muslims In Northern Nigeria Celebrate End Of Ramadan {URL},7
#WomenOfCourage @user Thanks Guru Papa #GurmeetRamRahimJi motivation the women in every field {URL},7
really gonna burn white british bitches if they breathe their toilet paper washed ass breath around bts,1
"bitches get beaten up by their boyfriends and stick around saying ""i see something in him"" like wtf you see a rematch💀",7
stop trying to invalidate the feelings of poc groups when YOU think something isn't offensive,7
@user Men: Women are Gold Diggers. Their place is in the kitchen . Go make me a sandwich Women: ... Men: it's just a joke man! You can't even take a joke? Chill,0
Some are lucky to go on and be successful but most of us have the urge to stay back and help the family. Send money to Tonga fua the church and the family kaveinga. Samoans are doing it big and imbedding hope for all of young Polynesia. Ion know y she comparing the two.,7
@user I pressed you nigga fytb shut ya bitch ass up too I'll beat you tf up on god you can't spell neither dumb ass bitch niggas say u sound like a 7 year old so stfu bitch u ass and you can run my series on bro🗣 (BLOCK LIST),1
@user @thehill Fuck Jesus. Fuck the Virgin Mother. Fuck the Holy Ghost. Fuck your Bronze Age Mumbo Jumbo. You sad sack of shit.,3
"@user Logan eagerly tasted his mouth, noticing the cookie dough from this morning. He kissed roughly, bucking into his touch st the ass grab.",7
"Officials are studying whether they are allowed to grant citizenship to babies born to Venezuelan parents. Below, Jose, born in Colombia to Venezuelan parents, reaches for his birth certificate that states ""not valid for citizenship."" 📸: @yamphoto {URL} {URL}",7
"What @GLAAD should know — IF they even care — is @Univision HEAVILY censors gay content, especially same sex male kissing. It is a true shame since the upcoming premiere of ""#ElCorazónNuncaSeEquivoca"" could be a sanctuary for #LGBT youth. {URL} #ArisTemo",7
"USAID Cambodia and Transparency International Cambodia are holding a video contest with the theme ""the roles of women and youth in politics or the equal rights of men and women in decision making"". #Cambodia Check out {URL} {URL}",7
"Shepherd, as the TA of an undergraduate communications course in 2017, held an irrelevant debate about trans identity instead of discussing the course material & was chastised for it. She has parlayed this into a career, largely based on claims that her views are being silenced. {URL}",7
this sluts lips need to be wrapped around a cock {URL},0
"Aleyna: I have been a sex worker since I was 16. I love my country and did not want to leave, but I came to the UK from Turkey to escape discrimination and transphobic violence and make a better life for myself & my family #InternationalSexWorkersDay @user",7
girls saying hi to the white boys at frat parties {URL},7
"@sairasameerarao No racist , they are coming in w diseases to kill Americans. U liberals are killing blacks w abortions",1
I'm available now on #EscortAds #SexyJulia {URL} #Detroit #Companion #online #booknow {URL},7
Yo kids ain't black they biracial...but they black when you wanna include them in some shit. They black then lmfaoooooooo @user {URL},7
@SonyaDevilleWWE I just wanted you to know that I admire you and what you stand for as far as the LBGTQ community so many people hide from it so it's refreshing to see someone who is actually proud to be what they are and fight for it...,7
Booker: can't we all just get along? Also Booker: DO YOU WANT IMMIGRANTS FROM SHITHOLE COUNTRIES OR NAH?,4
@user aww booboo - does the nasty woman intimidate your minuscule manhood? 🤣🤣🤣🤣,0
white people dont like eating raw fish but will eat bacon and pancakes every morning 🤮🤮,7
How fat is your penis? I watch Middle eastern porn and you men have huge penises. — ASTAGFAR BAJI PLEASE {URL},7
Idc if ur trolling but if ur black saying awful things about ur own race then ur most likely a self-hater in rl and need to seek help 😳,7
"In this church in Damascus, dozens of Syrian Christian and Muslim youth prepared meals together to distribute them to the public throughout the 27th holy night of Ramadan (the Night of Power | Lailet el Qadr) A true image of the city and this great country🇸🇾❤️🙏🏼 {URL}",7
"@Ancestry I know where I came from, back to the 12th century. You won't be getting my DNA to put into your CIA Databanks. @user @user",7
Girls who pee like this have da best pussy {URL},7
"@user @JonathanMerritt The Lord doesn't recognize false religion such as Catholics. There's one mediator between man and God, that's Jesus. You don't need a priest or a pope to talk to Jesus!",7
@user ugly ass dyke ass annoying ass short ass having bich,2
@user @user I am tall and love tall women,7
"Thanks for taking the time to spend the day discussing ways that we can promote the voices of #WOC and other underrepresented communities seeking to make a difference in peace, security, and foreign policy. @user {URL}",7
@EWErickson Whoa there Buddy!!! Who appointed you gatekeeper for Christians? I'm proud of my church.,7
President Trump is GREATEST President for the African American Population in US History! {URL},7
Yes u will u dumb day black ugly mf looking like a big of Potatoes head ass boy Cincinnati Burnie stupid bitch {URL},1
"Hate the male selection this year, where's the toxic masculinity? Smh #loveisland {URL}",7
"@user She's claims to be Christian (Baptist?) African-American and will continue to do so. Even though her father is a Jamaican immigrant, and she was raised by a divorced Tamil-Hindu mother.",7
I hate this bitch ass nigga,1
"""There can be no justice unless women are part of that justice"" @user #WD2019 #Humanitarian4Her @SaveChildrenCan",7
@user Fag ass,2
"To make a complaint about white supremacist, Steve Bannon being given 15 mins of uninterrupted air time on @BBCRadio4 @user go to {URL}",7
"I am a huge, nasty whore with a pussy that needs dick from white men from these countries Canada Sweden Norway Denmark Czech Republic",7
Heh at least those fat tits of yours are good for something! Now turn over I wanna use your ass in the same way! {URL},0
GIRLS. AND BOYS. CAN BE FRIENDS. WITHOUT BEING ATTRACTED TO ONE ANOTHER.,7
The genocide of Christians is going on today in the Middle East. They will not stop until all infidels are eliminated.,3
@user Eid Prayer is very important to people. And the fact is if a Muslim man hit your car and didn't leave a note. Their are millions of Muslims that WOULD have left a note and sorted it out after prayer :),7
"Internment camps. Orwellian surveillance. Silence. @IsobelYeung goes undercover in a special report that reveals how China is oppressing the Muslim minority Uighur people in horrific conditions. Watch ""They Come For Us At Night"" right now {URL} {URL}",7
✨Divine femininity ✨ {URL},7
@user Fuck him right off you were baptized by satan the minute you sucked a dick 🤣,2
Niggas couldn't beat the bulldawgs so they start beating bitches in real life 😭😭😭.,1
@AOC There is no force equal to a woman determined to rise W. E. B. Du Bois Thought you might need to hear this today.,7
"Get mistaken for Somali all the time Lool and that's fine but it's really annoying to have people constantly say ""oh same thing"" when you clarify. I understand uniting over similarities but u gotta respect, not dismiss ppls individuality too {URL}",7
"See how looking past negativity and being consistent works? These ladies will prosper, I've watched so many ppl talk shit and turn it around {URL}",7
If I start losing my bitch gon grab the tooly and let that hoe go off,0
"what happened to the women is unimaginable-unwritable😭😡 More than a million died along the journey,caravans of refugees just walked for days to reach R camps erected in cities, pushed to the brink by violence,looting,food shortages... Someone had the last laugh! #ModiFor2019 {URL}",7
"LMAOOOOO bruh I've experienced pretty girl privilege to the fullest extent, if u think that shit doesn't exist thennnnn you know the rest homegirl 🤣",7
"Hey folks, yo #mama is so #BLM , she shoplifts #samples from stores!",1
Too much. Choke her ass,0
Wizkid brought his a-game again on Brown Skin Girl alongside Beyoncé. Nice delivery.,7
how to tell if a woman likes you milf dating gay phone sex cute pickup lines to let someone down easy {URL},7
"I pray this is true & that Trump invokes this quickly & w/out any problems! We need to get rid of ALL ILLEGALS from this country before we turn into another France, England or Germany! It would be a good thing to do while Dem's are tied up in defending themselves against treason. {URL}",7
Are you really proud of the load you gave if you didn't taste it yourself? Make your bottom show you how much nut he sucked out of ur cock {URL},7
LGBT pissing me off now smfh {URL},7
"i think if men could just experience a day one period sneeze, all this sexism and misogyny and asking folks to smile would stop by 97%",7
the twitter dogs are eating my thanks for the bitch you are gay joke,7
Women like you start cause revolutions by simply existing. #womenpower,7
"Immigrant families make significant contributions to our economy, yet many are currently ineligible from accessing the #CalEITC #CAbudget {URL}",7
I wish I was a cop just to shoot you niggas,1
Same demon running concentration camps currently in the USA. Yes let's get A$AP Rocky out BUT what about the number of other Black people in the country you run who are incarcerated with grossly disproportionate sentences.,7
To find out more about the research {URL} #LGBTQ #childrenincare #careleavers {URL},7
Anne Kiguta: Welcome to Punchline. Our first guest is DP @WilliamsRuto and over the next hour we will talk about issues dear to Kenyans. #RutoOnPunchline {URL},7
"That's why they don't care that #MoscowMitch isn't doing anything to protect our elections. They've been frightened by a popular Black President, Influential Women of Color, Women in general, and all Brown people.",7
Fag Dennis Grahl from Berlin needs a Hard mouthfuck {URL},2
"Fairness and equality are core American values. I'm proud to join my colleagues in voting to pass the #EqualityAct, which will protect LBGTQ Americans from discrimination. {URL}",7
"""There are wonderful Muslims in my family. There are wonderful Muslims everywhere. But that doesn't make Islam wonderful."" @user British-Pakistani #ExMuslim {URL}",7
"Fuck that, I hope all you fuck niggas die😴",1
"@user By using the term queer, we're following the LGBTQ+ community who have been reclaiming the term as one that encompasses the full diversity of sexuality & gender, and so we believe it's one that best fits the scope of our discussion. We apologise if you've been offended by this.",7
@user Grow some fucking nuts and pick up a brick or something and defend yourself! Wtf,7
Wish I was slipping in and out of some pussy instead of depression 🤪✊🏽,7
"""And from His signs is that he made spouses for you from amongst yourselves..."" Surah al-Rūm. Recitation at a nikah ceremony today via @user 🙏 {URL}",7
@user @user They have no cause to claim asylum in the UK as they have travelled from a safe country (France). They should immediately be returned @user,7
You can't turn a hoe into a house wife hoes don't act right -Luda,0
@tedlieu @user The shooters ARE NOT immigrants. Think about that. @user,7
men should all die in a fire honestly they are a threat to the world,0
#PrideMonth #PrideMonth #PrideMonth #PrideMonth. Because there is not enough LGBTQ+ representation.,7
