text,label
"""Plug fuck yourself hard a couple dozen times. Full thrusts. Abuse your cunt for me. Then get a full throated taste. Now."" {URL}",0
"@user YES, WE'RE BOTH GAY",7
"Letter to PM Imran Khan, from an elderly resident of Indian Occupied Kashmir. Uncle also says ""That is what every truthful Kashmiri would be feeling for him right now."" My favourite part is ""..As you gave a reply to war by peace."" 💕 {URL}",7
@user Lots of Evangelical churches actually do pay taxes for the opportunity to preach politics and racism 🤢,7
Like nigga why you made women get their periods at ages 9-12??? Bitch who gave you the license?,7
@user @user Remember the rapes in Western Europe a few years ago? All Arabs and afghan refugees,7
@user The middle east if filled with scum,4
Lmfao uglass nigga look like the nigga Santa Claus from Friday after next {URL},7
What a fantastic group of women to be our world champions. {URL},7
Great news: citizenship can now be passed on in Iran from mothers who have married non-Iranian men. Many women in Iran & the diaspora have worked hard for years to make this a reality. {URL},7
"The good news is that according to surveys that we published at the Israel Democracy Institute, there is widespread consensus among Israelis on many of the most significant issues our country faces. Read by @user in @Jerusalem_Post {URL}",7
@user i will fucking end this bitch COME OFF ANON AND SQUARE THE FUCK UP LIKE A REAL WOMAN,0
"""3 in one special: bad bitch, dumb bitch and a sensitive bitch""",0
@JoaquinCastrotx @TheBlackCaucus so we now advocate only for Hispanics however when we need national attendance its POC #WeSeeYou #ADOSPolitics we've allowed ppl without our #LineageMatters in 🇺🇸 hijack whats Rightfully (citizenship) Ours.,7
The latest Your Muslim World ! {URL} #egypt #saudiarabia,7
@madhukishwar @davidfrawleyved Indian Hindus getting killed in India by Anti National Hindu terrorists and you are worrying about Pakistan and about your religion. Shame on you traitors.,7
Something happens to women between the ages of 16-25 where they become literally retarded and this tweet kinda proves my point,0
"Where the imperfect but trying niggas at ? Where the niggas that admit to they wrongs at ? Where the "" I got a female "" niggas at ?",7
That little bitch needs to suck my dick won't give her no kissy kissy,0
happy pride month help my queer ass pay for rainbow acrylics and drag costumes {URL},7
I'm crying again over edelgard and dorothea's b support nghhh girls flirting with each other!! and it's for real!! they're bi!! they're both actually for real bi!!!! edel-chan said she wasn't NOT interested in love but it probably will never happen,7
First time in the history a Pakistani PM Is this much famous in USA Feeling proud to have a PM like him ❤️ Allhamdulillah ❤️💯 #IKinUSA #PMIKVistingUS #PMIKJalsaInUSA {URL},7
"@user @user @user Nonbinary is a gender orientation & general umbrella term for people who do not strictly identify with being a guy or girl. Nonbinary can be a more static of an orientation, while genderfluid fluctuates. All genderfluid are nonbinary, but not all nonbinary people are genderfluid.",7
Two men one sexy women. 🌈🌈 {URL},7
"Maharaja Hari Singh trusted evil desert aliens & all native Kashmiris, Pandits, Hindus massacred, Prithviraj Chauhan showed mercy to evil aliens & millions of natives massacred , Gandhi trusted aliens & country divided, millions massacred. Never, ever trust evil desert aliens! {URL}",4
Bitch ass niggas be poppin it for pussy they never gone get,1
Qatar PM arrives in Saudi on first visit since Gulf crisis – media {URL},7
"A @BrennanCenter finds that nearly half of all states do not have a single justice sitting on their high courts who is black, Asian, Latino, or Native American — even though people of color make up about 40% of the population, via @user {URL}",7
We are excited to announce the launch of Racial Data! A new platform on demographic data and policy research about communities of color. Thank you to those who have been part of this amazing project to launch Racial Data. {URL},7
all that pussy nigga choose to eat her ass. hate to see it.,1
"The writer was also upset that she, a mother of 3, didn't get a chance to eat that morning. So she wanted to punish the metro worker for eating????? This lawsuit is the most entitled pile of garbage. She's accusing the publisher of attacking her cos she's a woman of color {URL}",7
"@MiddleEastMnt Just start executing your intellectuals, is that what Allah wants? Muslims need to wake up.",7
"Suck my dick you braindead pozzed pussy, research shows",0
@chetan_bhagat Funny. You wrote a letter to Kashmiri youth and published it happily. Everybody read it except the Kashmiri youth.,7
"my only purpose is to serve Big White Cock anytime, anywhere. 🍆🇺🇸👅 #cocksucker #blowjob #suckingcock #gloryhole #alphaworship #suckit #suckitbitch #suckitfag #fag #faggot #BWC #BWD #bigwhitedicks #bigwhitecock #bigwhitedick #publicbj #gagthefag #SuckItSaturday #SwallowSaturday {URL}",7
"@user @user @MarchofDimes @NYGovCuomo America will never achieve heard immunity; hundreds of unvaccinated, infected illegals criss into our country every single day. Have to close the borders first.",4
"@user @user @user Tell your fellow whites to stop using opiods and heroin at extremely high rates. Also, stop dominating in sex crimes and mass shootings.",1
"lmao to think user outrotear was homophobic & JUS then,, bts snapped w their lgbtq support thru bt21",7
"Please help support nonbinary / lesbian pride, add a #Twibbon now! {URL}",7
3 years ago today i came out to my madre,7
Fuck that stupid bitch.,0
you fags are so insufferable sometimes makes me want to convert to alt-rightism,2
The nigger in me wanna know how it taste {URL},7
Bitch my mom did not carry me for 40 weeks for me to come out and live my life to please a man lmfao {URL},7
"Who wants to start a fight? I'll start, I call gays fags",2
"@user @user @user @MsBlaireWhite Who wants self-ID? People not intent on transitioning, which generally means they're just ""identifiers"", or they are people who chose not to transition. In either case they are not trans and self-ID doesn't change that, it just gives them a ticket to be something they're not.",7
What constitutional rights do undocumented immigrants have? | PBS NewsHour {URL},7
I'm only interested in locking up your cock and controlling you. All of you. Get it? #MistressTea #femdom #chastity #locked #caged #owned #chastitylife #ChastityIsLife #permanentchastity #keyholder {URL},7
"idc if you dislike Halsey, or you dislike lgbtq+. This speech is powerful and should be shared. {URL}",7
Islam is a cruel hateful violent religion. It's eradication would make the world safe.,3
"Islam's holy land to be used to attack yet another Muslim country by the US and its coalition of imperialists, despots and terrorists?",7
"Let me be the first to say that I am 100% in support of a woman's right to choose what she wishes to do or not do with her body, no exceptions. With that being said the ability to make choices should be based on… {URL}",7
#ModiKillingKashmiris This picture shows the love of kashmiri youth for Pakistan... {URL},7
"Niggas be like ""I'm 5 mins away"" and don't get there for 30 It's me, I'm niggas",7
@user we gonna suck bite slap her big tits thn fuck them n jizz all on them shes such a fit slut,0
I fuck on yo hoe and then go home to my bitch,0
@user @tariqnasheed Over aggressive police tactics based on racism & knowledge they can get away w it. White cop who sucker punched that man should be arrested already. The other cop he was talking to didn't seem to be the least bit threatened by him but big man w the AR punched him anyway. Fuck him,7
"Stealing is Haram Prostitution is Haram Being a gigolo is Haram Getting married while pregnant is Haram Maltreatment of orphans is Haram Eating up the properties of orphans is Haram 3,7,40 days fidau prayers are Haram Condolence gathering too is Haram",7
I don't fuck with bitches ! {URL},7
If you think women are the weaker sex ....... Try pulling the blankets back to your side of the bed 😉😉😉,7
"If you look at how potential white nationalist terrorists are radicalized online, it makes perfect sense. It's exactly what ISIS did. Get disaffected young people on the fringes of society to fill the void in their souls with hate and evil. Men are particularly susceptible.",7
"@Joy_Villa @user Trump Train, Can we all get behind the straight pride parade? Time to celebrate our straightness. Even if U are not straight I am sure you know and love some straights so you can celebrate their straightness. Lets not give in to hate, celebrate straight. {URL}",7
I would like to see more women in politics but why are most of the exactly as useless as the males they want to replace?,7
I see a lot of Tumblr Swifties identifying as attentionsexual. Happy Pride!,7
Fuck you. Fuck the current administration. Fuck the bigots that pretend domestic terrorism isn't their responsibility as they not only radicalize but arm these shooters. Please do try to slap me so I can knock you back to your giant ground slug roots {URL},4
Omg bitch execute yourself ugh,0
LOOK: Filipinos join members of the Korean community in the Philippines at a march around Roxas Boulevard and Luneta to mark 70 years of diplomatic relations between PH & South Korea | via @user {URL},7
"All children should be respected in schools. Every single child whether Black, Asian, White, Hispanic, Indian .... even mixed race must be respected. Each child has an inherent value that must never be violated. Please share to help uncover the racism in the classroom",7
"@user When Kim jong un threatens to have a US citizen hanged for a crime in the North Korea, the world peace is threatened but when Israel rains down hell on PALESTINIANS in PALESTINE, the UN turns a blind eye. A double standard nobody nobody understands till this day.",7
"@user @user So seeing women on here, and seeing POC and WOC and esp black and indigenous women celebrate milestones or support missing goals or failing forward, that all helps break through systems and reframe who academics are, who belongs in stem",7
@GOPChairwoman @user 18-30 million illegals in this country...Congress & previous administrations have been letting Americans down for DECADES!,4
@DebraDiGiovanni It's funny how some straights seem to only get this straight pride during LGBTQ+ pride month {URL},7
"@user @user @user @user @user She can say what she likes, but that's not how DNA works anyway. The white race evolved from the same ancestors the blacks did. Whites aren't going anywhere. Unless they are planning to kill off whites, which makes them worse than Hitler... mixing won't exterminate ""white"" DNA {URL}",7
"On a scale on 1 to NIGGER, ""Go back to where you came from"" is like an 8.",1
"Hi, proud trans woman here. I don't have a uterus, so I don't center my body in conversations on abortion care. Drag queens engage in gender expression, which is not cultural appropriation. And yes, men like you are definitely scum. Thanks for coming to my Ted talk. {URL}",7
Only a Garhwali politician could have done this ! Jai Badri Vishal ! 🇮🇳 {URL},7
"( 2B has infinite ways to pleasure someone or fit to their needs. You wanna get dominated by a futa? she's got you You want sweet caring motherly dom? she's got you You want an android that insults your dick size, and fucks with a bigger man she's got you. She has it all.",7
This bitch deserves to burn in hell.,0
Why you hate immigrants?,7
What's next? Mandatory public stoning? What other ways can they dehumanize and abuse women to force them into doing what they want? #Maddow,7
"If India thinks Pakistan will keep silent, it will get a big shocking surprise. The world knows whats the real power of PAK Army. We demand US, UN & EU as well to intervene to stop such a bitter genocide of innocent Kashmiris. #Kashmir #OperationKashmir #IndiaUsingClusterBombs {URL}",7
Girls are WAY more selective than guys.,7
using chungha to bring down other women isn't a personality trait..some of u clearly never listened to chica,7
All you niggas can suck my dick,1
Fuck I just... Please someone fuck me with a huge cock and cum buckets in my hole! I need breeding and I need it now! #gay #gayyiff #gayfurry #furryporn #NSFW #cum #creampie #dick #sextoy #yaoi #yiff #furryyiff #femboy #lewd #furrysex #knot #masturbation #gayfur #horny #yiffy {URL},7
"First, they came for the immigrant, and I said nothing, because I was not an immigrant. We need to speak out. Act up. Persist. @user this is wrong. Deportation is not the answer. #ICEraids {URL}",7
"They ousted one of the world's worst dictators. Then came brutal counter-attacks from rich, militarised Islamic fundamentalists across borders. {URL} @user @user @user @user @user @user @user @user {URL}",7
niggas be having guns for show shit sad,1
Take care of your business and give our Arabian community culture a respect 🌷#Nicki_Minaj,7
"I really love the Overlooked No More series. A 19th century lesbian sculptor who married a woman 150 years before gay marriage was legal and described herself as a ""soft-shelled crab""? Sign me the heck up {URL}",7
Not fun fact - when you're a disabled woman many non-disabled women will do it to you too - as well as men of course. Pats on the head. Hand on the knee like I need reassuring. It's a lot. {URL},7
@user @user Cause ur a fat nigger with no goals just a cod ego,1
"What's important at this time is to continue to focus the work and research of women of Color. In particular, I HIGHLY recommend and encourage you to look into the work of my big Sister, Dr. Jioni Lewis, who is a preeminent expert of gendered racial microaggressions...",7
@ANGELAWHITE @user @user tripartite lesbian hot and exciting and very great 🌈🌈😍🔥😈🍑😋 {URL},7
@user We fucking them niggas up just for that 😂😂😂😂,1
hey y'all quick question is it ok to identify as non-binary even though you mainly feel more masculine than feminine/rarely feel feminine at all? i am confusion,7
Bitch I'm busy baby go and suck another cock 🔥 {URL},7
"@user Laws changing will do very little. Getting into the minds of these guys is the most important. White supremacists, M.E. terrorists, 20 something males who were never taught about empathy.",7
straight pride looks wild,7
No... go grab a white person as his VP. IF YOU'RE ABOUT BLACK TURNOUT... NOMINATE A BLACK PERSON.,7
"@user @user @robertmarawa This guy is a die hater of sodom, he goes to the fling and now thumbs down #Nairobi and even paints everyone corrupt no no that's why all Africans are shit as poop",1
"It's wild how scared white folks are of me, a short Asian lady with too many chin hairs and too little sense of fashion. Find a mightier enemy y'all. You're embarrassing yourselves.",7
The mass shooting that took place in El Paso yesterday really hits home for me. 1. Because my family lives there and 2. Because it was intended for my people. MEXICANS.,7
Girls Of Today Ain't Romantic Enough .,7
@user Lmfao cancers males are very annoying they childish an pathological liars 😭😭,0
Our government now imports illegal immigrants and deadly diseases. Our leaders are inept.,7
Good #integration policy starts with taking stock of the skills that migrants have. Here are lessons and good practices from OECD countries on how to do so: {URL},7
@IlhanMN Deport people who break the law and violate our immigration laws by committing fraud.,7
"Don't ask my why ion trust niggas , watched em hurt a bitch that ain do nun to em",1
"A #California bill would allow males who claim to be transgender to be transferred to women's prisons. Concerns have been raised, however, that in trying to protect transgenders from sexual abuse, the bill is setting up female inmates for just that. {URL}",7
"Umrah Weekly Indicator: Kingdom receives over 7,2 million pilgrims and issues 7,5 million visas. #SPAGOV {URL}",7
"""Why would anyone be afraid of coming out as asexual"" Exhibit A: (Source: 2016 Asexual Census) {URL}",7
"Black women more likely to experience sexual harassment in the workplace, study finds {URL}",7
I do believe we can declare miraculous things. When I went to Israel the first time in 2015 an older pastor stepped out in faith and declared a rainbow anointing over our small prayer group at the end of a prayer session in Capernaum! I actually was surprised and skeptical ...,7
"@user @user @SpeakerPelosi Unlike you having sex with your mom and dad and sisters? Probably doing your grandpsrents snd your dog. But oh wait. It says you are native american. Probably 1/20th and white as a ghost. Now get back to bed, your mommy is waiting to get pregnant again.",1
"@user @user @user Yess same guy saved many jewish lifes from nazi germany. You guys are so braindead, pathetic and delusional",7
"6/ Since then, remarkable progress has been made in our fight for equality, thanks to the fearless determination of the LGBTQ community and the allies we've gained along the way. #Pride #PrideMonth #Pride2019",7
@user I don't know about you but I've always wondered why do white people adopt black children is it a guilt thing,7
"Oh look, here is @Ed_Miliband campaigning for an antisemite. Every representative Jewish communal body has asked Labour to disown her. JLM have said they will not campaign for her. But Ed Miliband wants this racist in the Commons. For shame. {URL}",7
A stick and poke is what Brooklyn gays call sex.,7
Bitches is sluts omg washed tf up. Pussy trash asf. Had shit before omg I'm pissed,0
You know what to do faggots,2
"bisexuality and pansexuality overlap a lot but there are some discrepancies to different people, and those differences mean something to different people, and its no one's right to tell you that your sexuality isn't important or necessary",7
@user @user 😂😂😂😂 insulting a fellow female just to make your pathetic and worthless self feel better.,7
The hell these niggas doing lmfao {URL},7
@user Did I said her pussy! see you need to go read a fucking book! Fucking dumb ass. Small dick niggas can't think',1
sike luke lost his rights so fast u really can never trust white men,7
Men getting targeted in the RIP Bianca tread right now which completely divides us and has nothing to do with remembering Bianca. Shame on you idiots that are adding fuel and misinformation to this. Not all men are monsters and women can be one too. {URL},7
"Eid Mubarak to all muslims around the globe May Allah flood your life with happiness on this occasion, your heart with love, your soul with spiritual, your mind with wisdom, wishing you a very Happy Eid",7
"@user What do you mean you're sorry?! you spat on him your dirty fucking slut. Wouldn't even spit in your arsehole, I'd go in dry and hopefully hurt ya dirty fake fat fucking slaggy cunt",0
I want to breed a brainless whore right about now {URL},0
Somalian girls are shy 😂😂 ...they fear Saturday jokes with us😌,7
"@ZaidZamanHamid what a piece of shit this pig is, absolutely rubbish! i spit on your upbringing and on your faith too which taught you this.",3
@user She was a refugee you racist piece of shit! The United States caused her homeland to be destroyed you huge pile of human waste!,7
Better to unconditionally love India with a foreign passport than to have Indian passport and hate India. {URL},7
#CONGRESS MUST DO THERE JOB! AMERICANS MUST TAKE RESPONSIBILITY FOR THERE GOVERNMENT! IT IS TIME TO STOP THE GENOCIDE OCCURRING IN MUSLIM NATIONS by the US & ISRAEL! {URL},7
Happy #Pride! Ever heard of the Annual Reminders? Listen to @user and @user dig into this a little-known piece of LGBTQ history {URL} {URL},7
niggas dumb as hell for no reason at all,1
"""More! Pound me until I'm a dumb worthless pig addicted to cock!"" Chun spent the whole night taking the horse's meaty bitch breakers up her slut holes while squealing like a cum drunk sow~ all she could think about were thick cocks pounding away at her, breeding her over and over {URL}",0
Y'all orgy bitches STILL ugly swapping spit n shit with the whole group y'all ain't ever Hurd of herpes? 😣,0
"@RaquelWillis_ You're a disgusting human being. Actually, you're not even human. A 3 year old doesn't know anything. Any parent who supports transgenderism in their child deserves to have their children taken away. If you're doing this, you should have your children taken away.",7
Indian kill the Kashmiris and some puppet said Kashmiri's lives with India not with Pakistan Chutiye #UNandOICsaveKashmiri {URL},1
Only the happiness of certain women in Rajasthan matters?,7
"Stop twerking your ass and start twerking your brains, i don't need a girl with ass what i need is a girl who's smart and knows how to take care of me",7
@user @user Them niggas fight like hockey players,7
"i want you to choke me and whisper ""you little slut"" while you finger my pussy ..",7
Of course he did it. Another rage filled inept man. Taking out his inadequacies on women & children. He should be shot.,0
"Simply the biggest nut >>>>> Niggers be like a fucking joke, my glock, fuck my ass.",1
@user @user I've been to Israel and Palestine so have seen the situation first hand. Never had citizenship lessons at school so don't know where you got that from,7
New video for now live! This hot little twink knew how to take every inch of my dick and he loved it! {URL} @user @user @user @user @user @user @user @user {URL},7
Your wife hates me I like provoking her jealousy Tribute or I'll dump you the instant she gets fed up & leaves #hotwife #cuck #cuckold #wife #homewrecker #divorce #cheating #GPRT #alpha #goddess #mistress #worship #girlfriend #sidepiece #hotwifing #ruined #girlfriendexperience {URL},0
#TheUrbanDebate | Story 6: #BiharFloods Convenor of National Alliance of People's Movements Ashish Ranjan tells if the people of Bihar are receiving the state's help {URL},7
@user @user @user @user @user @user @snowFNBR fuck u faggot,2
Women think about it too {URL},7
"some girls will actually stay at home for the sake of being looked at as ""wifey material"" by the mandem, you think mandem will stop me from living my best life? You're definitely mad",7
"When you eat her pussy spell ""You lying bitch"" on her clit",0
when someone uses the wrong pronouns/refers to a cis person incorrectly its not misgendering please use misidentified or something else misgendering is a specific word for trans ppls experiences with it and no cis person could ever truly feel the same impact it has on us,7
"@user with that being said, if my siblings ever came out as gay or lesbian, without a doubt in my mind my family will make the joke *more than once* per family dinner ""at least you're sticking with one. unlike -nods towards innocent, bored and bi me- over here"" the audience laughs etc",7
"I really want daddy to train me to take his cock n make fun of me for being so pathetic, I wanna be a brainless slut for him :((",7
God is gonna strike me and send me to hell because IM CRYIN🤣,7
"@user I grew up hearing similar lines of thinking: ""If Christians have the Holy Spirit we should be the best at everything!""",7
@ndtv Many many congrats. He is the real India 🇮🇳,7
I don't even want a boyfriend but like a gay best friend would be nice,7
@user Stop fucking niggas that got hot cheeto dust and blunt residue under their finger nails,1
@user I fuck your pussy hard,7
@user @user @user Lol you Arabs just mad because you can't supply Uyghur freedom fighters with firearms and bombs,7
@user @user SHUT THE FUCC UP YOU UGLY BITCH,0
@user @user Sick of this pc crap. I would like to think my achievements were down to my abilities and hard work not because I have a vagina.,7
"Let it be known to everyone, the story of Pakistan, the story of Lahore, is the story of love; the love between a Sufi saint and a Hindu boy - a line could divide two religions and create two nations but it could not push apart Shah Hussain and Madhu Lal, who still lay together.",7
"@user How does that make sense?? ""Honey it's just the internet waves, theyre giving you bad feelings. You're not trans tho I promise""",7
@IngrahamAngle They should be in fenced in tent cities. Treated humanely and sent home. Emotions and fears of being called racist or mean are bankrupting and destroying this once great nation.,4
You hoes will still get beat up try me,0
"men are so fake to each other, sometimes more than girls lmfao",7
"ICYMI: I wrote about the history of queerness on SNL — its absence and presence, and the ways we used to laugh at and with it — and compiled a bunch of favorite sketches (and also less-favorite ones that were burned into my psyche FOR SOME REASON): {URL} {URL}",7
@user @user @cnnbrk Go have some cow urine.... And it's going dark u need to go to fields for doing shit... Islam is a religion from thousands years but u make ur God with cement every next year. Don't try to teach father how to fuck u asshole.,3
"@TomiLahren Long after Trump is gone high amounts of people will be coming to the US to seek refugee from the crime chaos. ASK YOUR ELDERS IN YOUR FAMILY WHY THEY CAME TO THE US!!! They was running away from something, someone or a combination of the two...",7
With this they have verified that their masters are #IslamicState Hope they knew how women was treated under 370,7
"@user @user That's perfectly fine! Especially if the politician of color is a member of .@TheDemocrats Party, & the white politician is a member of the .@GOP",7
"fuck bitches, id rather be a fag and fuck guys, sike",2
Beautiful message. I love being a black woman.,7
Just sold a #clip - FITNESS HOT WIFE ON VACATION II-BEING A CUM EATER CUCKOLD IS CODED IN YOUR GENES!:COUNTLESS HUGE CUMSHOT AND CUM EATING CUCKOLD HUMILIATION (WMV) {URL} #CUCKOLDING via @Clips4Sale {URL},0
