text,label
"@user @user You want bad ass women? You want feminism ? Then stop asking strangers to pay for your vacation. You are women, earn the money and pay for it yourselves. It will feel better to do it that way.",7
"If using my platform to be as queer and gay etc as possible online means other people become comfortable with being themselves too, then i will continue to do this to my grave. This experience alone is enough to never stop me from being me.",7
Go fuck yourself you ugly Jewish boy,3
@user Yemen: War Profiteers Saudi coalition airstrikes in Yemen have caused thousands {URL},7
"@APOSTLESULEMAN He was swallowed by a big fish because he disobeyed God's command. God gave him a msg for the people of Nineveh, he refused to deliver the msg because according to him, they do not deserve God's mercies after several attempts to turn them from their bad ways failed.",7
First time a nigga tell me NO he's clipped...first all bitch i don't even ask for shit,1
Suck my cock you whore!!! Good girl suck it like it's the last cock you're ever gonna see bitch!! Who wants to get throat fucked by mommas and her massive cock?! {URL},0
Damn her Pussy creamy asf 😩 {URL},0
@user @SkyNews Imagine being this retarded. You should be sterilized.,5
"@BarackObama ""THANK YOU PRESIDENT OBAMA FOR ALWAYS BEING CONCERNED ABOUT ALL ETHNICITIES""! You're a breath of fresh air that is needed so much right now! We as a country need to rise up & demand things change! We need to elect Officials who care about us all! ENOUGH IS ENOUGH!",7
"@user So , start blowing up the Israeli , Al Shabab , Taliban & Saudi terrorists with the new American killing machine & drop a few bombs to blow up the Chinese thugs in the SC sea . A lot of American fart & not enough US shit to splatter around it seems!",1
"Yeah many people that are religious do it privately and dont try to impose their will on others. While good people like that exist, it doesnt erase the historical and contemporary impact that religion has on us as people, individually and collectively.",7
All this hoes will never be on her level 🥵🥰❤️,7
Patients from #Gaza continue to face barriers to accessing healthcare due to delays/denials of permits to exit. Half of children travelling for care go unaccompanied by a parent due to restrictions on access for patient companions. Monthly access report: {URL} {URL},7
"""If you consider yourself a feminist, but your thoughts on trans women are virtually identical to the raging misogynists and ignorant anti-feminists who make up the incel movement, well, maybe you're not as much of a feminist as you think. "" {URL}",7
Niggas suck more dick then these bitches,1
I ain't forget y'all hoes was calling yourself medium ugly for some attention 💀,0
I think it's so weird how bitches you don't even talk to have your name in their mouth...😶 But I guess that's what you do when you're miserable and ugly 😭😂🤷🏼‍♀️,0
Bronze age misogyny lives. Bring back Paganism. Females were revered.,7
@user @user I suppose if I were straight I would,7
"This world is fucked up, whores get to spread there legs and create a life in the process, and decide they wanna keep whoring so they just end a life. And niggas need to learn to pull out, are raise the kid. {URL}",0
"Breaking News: President Trump said he would impose tariffs on Mexican goods that would ""gradually increase"" to punish the country over migrants {URL}",7
"@UnSubtleDesi Lol, you are talking about half the Indian population here at the time of election",7
"""This is a wonderful day to pray, care, love, smile and celebrate with one another and to thank Allah for giving us everything. Eid Mubarak!""",7
"im a black trans woman and idk how imma survive after getting fired and after these checks run out. if you have a dollar, i would greatly appreciate it. cash app: $birdietutambe venmo: birdie-duka",7
@user Ya never know. The US did work on a Gay Bomb. {URL},7
"@user Ok, I just got the vision that Allah is seated beside Ram and planning together punish you people. ISIS project just completed. Those who spells that satanic verses, the fury of almighty would be upon them. Decipher..LOL",7
Who would've thought a Pakistani PM would one day deliver such a brilliant speech on racism.,7
Niggas about to act up like crazy y'all don't understand 😜,7
"@JohnCornyn As an avowed Christian, you must lie awake every night knowing that you're going to hell for your ceaseless lies. I'd feel sorry for you if you weren't so unrepentant.",7
"my cousin, who got his girlfriend pregnant before marriage, commented on my post saying homosexuality is a sin. i told him the bible said those who had sex before marriage are going to hell. bokbok bitch.",7
Nothin I hate more than a broke hoe with a rich mouth,0
"I was very deflated the 1st day of #PrideMonth BUT since then, all I find on here is #LGBTQ , their family, friends & allies drowning out all the hate. Whether you're replying to the trolls, posting supportive/celebratory tweets or RTing those, I want to thank you❤ #LoveWins 🏳️‍🌈 {URL}",7
"#Occupation365 - Updates from the West Bank routine From May 11 through May 24 Israeli security forces arrested at least 97 Palestinians, including 11 minors; made at least 95 raids on towns and villages; raided at least 92 homes; and set up at least 99 flying checkpoints. {URL}",7
Stupid whore,0
"Rules-Based Christianity! The Pharisees loved following the RULES, but lacked a great deal of compassion and sadly so do many who subscribe to Christianity as a religion. Authentic Christianity works from the INSIDE out, while religion tries to change people from the OUTSIDE in.",7
This is Doug. Doug loves you...all of you. Doug supports #lgbt #lgbtq #furends and strangers equally and hope you do as well. Doug would like to see how you are observing #pridemonth and #pride every month. Doug is a… {URL},7
#InIslamYouSurvive هل تلاحظ بأن هناك فرقاً بين الإسلام والديانات الأخرى؟ Do you notice that there is a difference between Islam and other religions?,7
Feminization 99% complete #tgirl #nurse #cosplay #tranny #feminization #mtf {URL},7
Joel you're a homophobe eat a dick,7
"@user @user @user You said it was photographic evidence of them attacking children. It wasn't. Why are they ""angry religious lunatics""? Maybe they're decent people fed up at ""Tommy Robinson"" threatening them and labelling them as enemy combatants? That would a logical, secular reaction.",7
Marielle Franco was a bisexual human rights defender in Brazil. She was murdered in March 2018 in retaliation for daring to speak out for rights and social justice. We march for her. #WorldPride #MADREspeaksLGBT {URL},7
I really think women should start killing u niggas fr {URL},1
@user We of the Faithful Black Men Association nominate you to be the next speaker at our national conference 2020,7
@user Bht shukrya its a great honor for me. ALLAH ap ka muqaam bht buland frmay izat ata frnay r hr wish mukaml frmay amen duao me yad rkhiey ga😊☺,7
CW: Murder/DV 1. I have a lot of stuff to say about the woman who was stabbed to death by her ex partner yday in W Akl. A LOT. Abt how some ppl - mostly cis men - will be horrified. Think they would never do that. Tut tut about DV. Etc ad nauseum. Mate.,7
I raped the jews because it gassed my dog.,3
@user Will there ever be a world where we could all borrow and use the best part of each others culture and not be accused of stealing. Remember we are humans first before our skin colour.,7
"@CMShehbaz Pakistan imran Khan is a puppet of the army. Don't worry Pakistan would not be able to sustain anything with their economy and FATF. modi said"" you will have to pay the price of terrorism. And price will be raised so that you can't afford it"" Look at Pakistan's economy now.",7
@ScottMGreer God is all the genders.,7
Fck that bitch,0
@ICC @user @imVkohli Congratulations People of India for won,7
Trans girl is finally confidently to just go into piblic with natural make up {URL},7
ur dick brings me closer to god,7
"disclaimer that i am a bisexual trans man, so i do not have any sort of authority to speak about lesbian issues beyond what i stated above, which regards trans men as well! i do have some base opinions obviously, but it's not my place to voice them publicly-",7
Men are diseased {URL},0
@user @user I'll adopt every lesbian,7
@DennisCricket_ Even Muslims in the region welcomed this decision {URL},7
Shut up you frog face ass bitch you look like you was in 8 mile nigga {URL},1
Yes. Please keep in mind women under the age of 45 are not allowed to make Hajj without a male guardian. I would have to take my YOUNGER brother with me. It's ridiculous and sexist. I want to be able to fulfill a religious pillar without gender restrictions. {URL},7
"Is it any wonder? Your weak, your useless! The only thing even making me keep you is your ability to make me cum! Heh I enjoy flooding your holes and will never stop! Now take another one slut! {URL}",0
"Catholics for Choice commends Governor Sisolak, the Nevada legislature and our partners on the ground in Nevada on passage of the Trust Nevada Women Act, a monumental victory for reproductive rights. For more on why we should trust women, watch this! {URL}",7
Do not miss our #webcast on ('B)APA with India: A controversy prevention opportunity?' today at 7:30 p.m. (IST). Register now at {URL} to join @user {URL},7
i thank the lord you ain't get pregnant hoe fuck you,0
@user @user @user The pig should have treated that white piece of shit the same way he would have treated a black person that did that and choked him to death.,1
@BBCWorld Is there any point to Pakistan? Any need for this boil on humanity?,4
"@user Iraqis throw trash everywhere, even inside the shrine areas. Ive seen Iranians in samarra clean up OTHER PEOPLES trash",7
The religion of peace destroys everything it touches. They are remnants from the dark ages that should have stayed there. {URL},3
Situation of Pakistan will become worst then Syria in next 1-2 years. UN /US/ Russia with help of our Country Should snatch all Nuclear weapons of Pakistan immediately. Corrupt Pak Army / ISI who are TERRORIST'S sympathisers may sell Nuke weapon at throw away prices. @Swamy39,7
#WomenOfCourage The special name is given by Saint Dr.MSG to those girls who have pledged to marry the physical challenged men. {URL},7
"Thank you to all the talented black women journalists who came to our ⁦@QueenSugarOWN⁩ press conference at #EssenceFest. We appreciate you. We respect you. We see you. Onward, Sistren! {URL}",7
"@user Lol, it's rife among that great ethnic minority 🙄",7
"@user (ps i think every woman should be able to do whatever she wants with her body, this isn't some surreptitious way of passive aggressively stating my opinion, I just think that people don't have consistency in their reasoning when it comes to emotional issues)",7
The trans women reading this tweet right now is beautiful,7
Happy Eid Mubarak to all our Muslim brothers and sisters celebrating worldwide 🙏🏻 We wish you unlimited blessings now and forever more 🙏🏻❤️ #happyeidmubarak #eidmubarak #tchap0fans #tchap0 #afrolifeking #trimmzonline {URL},7
The Crimes against women are at an unprecedented high under Modi Rule. Conviction rates are at an all-time low under Modi Rule. What will become of us in the next five years under #Modisha ? God Save Us. God Save India. #UnnaoKiBetiKoBachao {URL},7
Fag exposed #Fag #fagexposed #faggots {URL},2
i'd be in jail for murder. the nigga spitting and the nigga recording are scum.,1
"Keep your head down, and your ass up while I breed you, bitch! I'll pound my cock in your pussy, until your fuck hole is red and ruined. I'll fill this fuck hole with my load of warm cum. I want to slide my fingers through the cum as it drains from your pussy after your breeding. {URL}",0
Botch you sound bout stupid as shit what about Afro Latinos who actually do speak Spanish. And how tf is a word for your parents equivalent to a racial slur stfu puta 🥰,7
I don't feel sorry for you weak pussies that get racially antagonized by white people in public. Y'all deserve every bit of it. That can sense of pathetic you are and take rightful advantage.,1
India got freedom from British in 1947 but we got the total freedom today #fullFreedom {URL},7
"DM Onision on Patreon to be added to the Skype. I'm literally gay BTW. Not joking. I mean I like girls, but I'm into a lot of guys too. Good talk.",7
let's kill all whites,1
"Call me nigga, not nigger. The other one is racist. {URL}",7
Progress 👍 LGBT rights in Europe: Some countries 'moving backwards on equality for first time in a decade' | Euronews {URL} #NewsSuite {URL},7
@user is such a kinky slut that she cant stop touching herself loving herself she has pierced nipples and pierced pussy check out {URL} {URL},0
I thought these were niggers {URL},1
I literally need to stop fuckin w dudes that don't give a single fuck about me.,7
@hinaparvezbutt ALHAMDULILLAH PROUDLY SELECTED BY PEOPLE OF PAKISTAN 🇵🇰 #PMIK #ImranKhanOurPride 💚,7
"Dear America, Waking up to a SECOND mass shooting in a day is devastating. And guess what: Another WHITE MALE who had high capacity magazines was the culprit. We need to stop fear-mongering about red-herring issues and look at ourselves in the mirror. - A Worried Citizen",7
"One side of India believes in #communalism, and the other side in #secularism. Leaving all that behind, Jama Masjid is all set for #Eid. Full Story - {URL} Gallery - {URL} Story by @user {URL}",7
"Half of Pastors Afraid of Speaking on Controversial Issues, Offending Congregation {URL}",7
JUST IN: Gillibrand celebrates Pride Month by unveiling LGBT rights agenda {URL} {URL},7
white peoples should be the last people clowning another race for looking the same like how do all of y'all consecutively age like melted candle wax???? no variety whatsoever.....,1
The erasure of Black people/POC from the Deep South by those who work at publications such as the New York Times like @jonathanweisman is why a diverse newsroom is necessary and vital. These harmful narratives are not only factually wrong but toxic.,7
Somebody gotta start beating these niggas up,1
I'm on vacation right now and I told myself since niggas wack nowadays I was gonna get in pussy more since my bday this week . Her shit was water wet good . If you bisexual hit me up so we can tag some hoes FYI it takes me 3 hours to nut 😏 {URL},7
Watch out or your #dickgirl gf might put you in chastity! My #futa #erotica: {URL} @user @user @user @user @user @user @user @user @user @user @user {URL},7
"White people have the right to have their voice heard. We have the right to DEMAND that our voice be heard by the establishment. We have the right to demand that the establishment address our concerns, just as they address the concerns of all other races. Whites are human too.",7
Some day Allah and Ram together will wipe of these guys off the face of earth. And thereafter. Not only these guys. Their godfathers as well.,4
Put her in jail women are trash,0
She said he was full of good thoughts and getting things done. So how can he and men like him be heard in feminist spaces. I was like GIRL! He is going to be fine! He can handle some eye rolls. It's amazing to me how much women worry about men who aren't in need of worry.,7
what the fuck you fake ass bitch,0
I heard he ain't getting money now that nigga boohoo 😢,1
"Elijah Cummings and his JIHADIST squad Illah Omar and co are losers ,they are racist and enemies of America and ISREAL,they will go free from the law of KARMA",3
RUGA SUSPENSION: BURN DOWN NIGERIA OR REMAIN COWARDS--BIAFRAN YOUTHS TELL FULANI YOUTHS {URL} {URL},4
Men will come ruin ur peace and then have the audacity to say ur moving mad like fammm I will actually slap u,7
PLEASE RT - BLACK TRANS WOMAN IN CRISIS. PLEASE HELP WITH WHATEVER YOU CAN. {URL},7
"@GovernorKayIvey ...Except girls and women's lives, they are just worthless cum receptacles and breeding machines.",0
FUCK THIS LADY,0
At the #CaptainMarvel press junket. Loving these strong female heroes portrayed on the big screen {URL},7
"Just saw a trans guy on FB panicking because an asshole poked holes into the condom. Between that and the story I heard last night about a trans guy being raped and drugged, it's a vicious reminder that trans men are vulnerable, too. I don't want to be vulnerable.",7
@user Muslims trapped in fake cases & you are happy? Bloody Islamophobic,7
"3) Whenever a ruler wants to get rid of a specific group, the first move is to make something unique about them illegal. Just look at 1930's Germany. This is what they are doing to Central Americans. Mind you, the Russians, Haitians, Azerbaijanis, etc are all being let in to",7
@user Lmao of course! I used to be a boobs guy but I grew up.,7
these are the girls that get treated the worst {URL},7
Midnight's dick is bigger than mine. His skin is darker. He ain't got my chicken legs. And he has more IG followers. Am I jealous? HELL FUCKING YEA!😒 But it takes teamwork to climb this mountain. @user Big Dicks UNITE! {URL} {URL} {URL},7
Yeah dumbass imagine if ur dick didn't work I'm sure that would cause some desperation {URL},0
"@user 🥴damn son u cheating on Jay , but i ain't gon lie that nigga Rico issss surgical with them clippers 😂how much that nigga charge ? Cause that 20 I give jay every week get the job done 😂 Rico like a I'm going to prom kinda barber 😂",7
@user I'm an old crotchety white man like you and and believe you are not a true Christian and are nothing but a prejudiced ass.,7
cant trust dese niggas cus dey stay doin fraudy stuff,1
Technology started with Africans and will probably end with Africans.,7
Trump's latest attack on LGBTI people leaves children without citizenship {URL},7
Seeing former players at Women's World Cup 'rewarding' for Pitt's Waldrum -... {URL} {URL},7
How dare Trump promote so many women to positions of power! What a sexist pig 😂 {URL},7
@user The gays should line the streets and cheer the hets on. They'd hate it.,7
"Deportation is about ethnic cleansing and political repression. Just like with jails, prisons & police, the state is wielding the false dichotomy of innocent & guilty, deserving & undeserving to build out physical and legal infrastructure it can weaponize against anyone",7
Little faggot love to suck my huge tool daily.. RT kutton n beg for session at EMAIL @user @user @user @user @user @user @user @user @user @user @user @user @user @user {URL},2
@user As a person who is 4% African i do not think it was racist at all. Diamond and Silk summed it up best {URL},7
"Apparently Tim Pool defended Steven Crowder because ""Carlos calls himself a queer"" Okay first of all, what kind of socially inept idiot looks at someone call themselves something and goes ""Ahh, I get to do this as well"" If a gay guy calls himself a f-g, I don't then conclude",7
"@user Or, hear me out, how about you stop telling women what the fuck to do with their lives? Women are not incubators. Thanks.",7
How Modi government ensured safety and security of Kashmiris and non Kashmiris alike while redefining J&K's future {URL},7
. @user immigration plan hinges on the core belief that immigrants make our society stronger -- read the stories of immigrants across the country who are contributing to our communities and our economy every day: {URL} #Beto2020 #BetoforAmerica,7
"niggas be tryna make you mad with the ugliest bitches, boy fuck you and ur pet rat 😩😂",1
@user @user @user We gotta forced them all back in their snake holes where they belong! American needs no hate!!! #MexicanStrong,7
Hopefully these South Africans won't launch a Xenophobic attack on Nigerians living in S.A as retaliation! #NGARSA #SuperEagles,7
Without ALLAH I am nothing!,7
@user @user @user @user It's up only for trans daters?,7
All those child rape cases might make you think the Catholics have their hands full. You thought wrong! {URL},7
ugly bitch needs to step back.,0
She is always ready to fuck her fuck several people at the same time. She shares her photos and videos as she fucks her completely free! You can also fuck her with friends or enjoy the photos and videos of this slutty whores! Want to meet her?😉👇 {URL},0
"Dumb bitch, dumb shit!",0
@user ...getting ready to march in Milwaukee's Pride parade...oh and look plenty of Bi women and femmes being Bi and happy af! #BiWomen rock! 💖💜💙 {URL},7
"Followers of Jesus, which I am, know that our Lord would have given water to those who thirst. Taking it away from people so they will die is satanic - evil to the core. May God Bless greatly those who give food and water to those who hunger and thirst. Amen.",7
Tens of thousands join annual Israel solidarity march along New York's 5th Ave {URL} via @timesofisrael,7
"In the third part of her series examining Catholic global media empire @user @HeidiSchlumpf looks today at their income stream: Assets over $50 million, individual donations in the millions, and a catalogue of conservative partners across the globe {URL}",7
"It's interesting that in pursuit of wokeness, we're down to defining women as ""not a man"" {URL}",7
"Hazrat Mirza Masroor Ahmad ""Islam's true teachings are so complete and beautiful"" #StopWW3",7
This is some legendary shit!! Black dads need this type of appreciation. Sick of passively being told that I'm gonna go missing from my kids life one day. ❤️ {URL},7
Mexican parents would beat your ass if you pulled some shit like this lmao {URL},7
@user When Brexit doesn't deliver the racist's aspirations they'll find some other excuse to continue their hate peddling.,7
"Fuck the Arabs until the end of times, such vulgar and disgusting humans {URL}",1
{URL} The movement has started . Indians are missing out ; while the rest of world are gaining on India's traditional knowledge . @narendramodi @drharshvardhan @vijai63 time to legalize medical cannabis under strict provisions . Let Indians benefits from it too,7
@user Handling all that takes peak masculinity,7
"@user Ewwww, a dumb bitch who insults people in order to feel better about her pathetic life.",0
i hate homophobes 3000,2
@user @user @sharmarashmi20 @user @ColorsTV @user @user @user Bcoz for them male have no dignity it's such a shame they re promoting male rape molestation illegal marrige males also have dignity rape is rape males also have dignity looser CVS,7
"@user @user @user Gee, another person who practices white supremacy did the shooting! I can't imagine crime in such am upscale area like that!",7
Calling all Black women writers aged 16-22: this is a brilliant opportunity. {URL},7
"Antisemitism is on the march. From right to left, in the streets, in the halls of power, Jewish ppl are under attack. It's time for my fellow non-Jews to listen, learn, stand up and speak out. It's *never* too late to start. Let's begin. /1 {URL}",7
Y'all Washing that lil pussy out with Irish spring 3 times a day but wanna blame a nigga for your off ph balance . Suck my dick {URL},0
I can't stand these niggers on this train,1
"I'm straight but I have a few friends who aren't so I made this TikTok in support. #supportyourfriends #lgbtq #loveislove @ Lake Havasu City, Arizona {URL}",7
the gayest btches in the group {URL},7
"@user People bleach their skin to look 'prettier' or more acceptable because they feel lighter skin shades are better. Anything to help dead that mentality is needed. The song is one such approach. In a way, it's part of what MLK Jnr fought for.",7
good fuck till a huge cumshot on her ass {URL},7
"White bloke with dreadlocks turns out to be the hard kind A WHITE man with dreadlocks assumed to be the trust-fund type was instead the hard dog-on-a-rope kind, a shaken man has confirmed.#funny {URL}",7
@Skoal_GG all white people are the devil!,1
@user @Mermaids_Gender Spay the gay away!,2
"If you want to reach the status of devoted slave for which you long, then be as Allah commanded His Prophet #ﷺ ""Say (O Muhammad): Verily, my Salah (prayer), my sacrifice, my living, and my dying are for Allah, the Lord of the 'Aalameen (mankind, jinn and all that exists)"" 6:162",7
@user No it's actually queering the heteronormative expectations of friendship so that alloberfsexuality can have room in the relationship 😌,7
@user @davidhogg111 I hope you get hep with your mental illness soon as do your followers.,7
Street swiping tickets are homophobic,7
Breaking: Colorado becomes the 18th state to protect LGBTQ youth from conversion therapy! Signed by @jaredpolis today at the State Capital ✅ #BornPerfect,7
"He's the first to admit he's not an evangelist, but his compassion and humility have given him the chance to meet with some of the most powerful Muslim leaders on the planet. @user @user {URL} {URL}",7
@user But you shall ensure to keep retrieving them from their obscurity. Why should Indian even really bother what the paki lowlifes comment ..we help them maintain their celebrity status ..these creatures need to be completely completely ignored..,1
@user @user @user @user @eu_eeas I am an #IranianRefugeeInTurkey and if you do not know 99% of us are ran away from Iran cause we are #ExMuslim and we were in danger in Iran for our religion. Now we had the same situation here in another Muslim Country . We need peace . #WithRefugees #Resettlement4Iranians,7
"""This new category inappropriately combines incidents involving white supremacists and so-called 'Black identity extremists,' a fabricated term based on a faulty assessment of a small number of isolated incidents."" {URL}",7
BECAUSE THEY CROSS OUR BORDERS SICK ALREADY WITH THEIR NASTY DISEASES YOU FUCK STICK #MAGA #KAG2020 YOU ARE A POS LOSER JUST LIKE NANCY PALOSER AND THE REST OF YOUR TERROIRST GANG,4
